{
  "id": "met",
  "tab": "mission-phases",
  "order": 6,
  "diagram": "met.svg",
  "diagram_quality": "polished",
  "see_in_app": [
    { "route": "/fly", "context_key": "/fly's HUD shows MET in days since launch" }
  ],
  "links": [
    { "l": "Wikipedia · Mission elapsed time", "u": "https://en.wikipedia.org/wiki/Mission_Elapsed_Time", "t": "intro" }
  ]
}
