{
  "id": "trans-x-injection",
  "tab": "mission-phases",
  "order": 2,
  "photo": {
    "src": "/images/science/trans-lunar-injection.webp",
    "credit": "NASA · Trans-Lunar Injection trajectory diagram. The single burn that lifts a spacecraft from low Earth orbit onto a Moon-bound trajectory — Apollo's S-IVB stage performed it about 2.5 hours after Earth orbit insertion; modern crewed lunar architectures will perform analogous TLIs from Orion + the Gateway."
  },
  "see_in_app": [
    {
      "route": "/missions",
      "context_key": "TLI/TMI ∆v is the first row of every interplanetary FLIGHT tab"
    }
  ],
  "links": [
    {
      "l": "Wikipedia · Trans-lunar injection",
      "u": "https://en.wikipedia.org/wiki/Trans-lunar_injection",
      "t": "intro"
    },
    {
      "l": "NASA · Basics of Space Flight — Trajectories",
      "u": "https://science.nasa.gov/learn/basics-of-space-flight/chapter4-1/",
      "t": "core"
    }
  ],
  "diagram": "trans-x-injection.webp",
  "diagram_quality": "polished"
}
